{
  "$schema": "./blueprint.schema.json",
  "kind": "topic",
  "blueprint_version": "1.0.0",
  "product": "Practice Lab Studio",
  "requires_manual_configuration": true,
  "native_import_package": false,
  "description": "Original design specification for one manually authored Create Worksheet topic. Placeholders and transitions are explanatory notation, not native topic YAML/JSON or an importable solution.",
  "bindings": {
    "extract_prompt": "${EXTRACT_PROMPT_ID}",
    "edit_prompt": "${EDIT_PROMPT_ID}",
    "preview_prompt": "${PREVIEW_PROMPT_ID}",
    "generate_doc_flow": "${GENERATE_DOC_FLOW_ID}",
    "optional_source_reader": "${YOUR_APPROVED_SOURCE_READER}"
  },
  "runtime_contract": {
    "schema_path": "../schemas/worksheet.schema.json",
    "key_count": 17,
    "value_type": "string",
    "field_keys": [
      "PATitle",
      "PASubtitle",
      "CourseReference",
      "Authors",
      "Contributors",
      "LastUpdated",
      "TargetAudience",
      "Duration",
      "ActivityDescription",
      "TrainerGuidelines",
      "DesiredLearningOutcome",
      "WhatIsNeeded",
      "SkillsBasedLearningObjectives",
      "DocumentationAndReferences",
      "ActivitySteps",
      "Validation",
      "Notes"
    ]
  },
  "configuration": {
    "topic_name": "Create Worksheet",
    "topic_count": 1,
    "topic_inputs": {
      "SearchQuery": {
        "type": "string",
        "default": "",
        "description": "Full raw source content when already available. Never a search phrase, URL-only request, summary, or citation. Empty starts explicit source intake."
      }
    },
    "tool_policy": {
      "availability": "Only when referenced by topics or agents",
      "topic_tools": ["ExtractPA", "EditPA", "FormatPreview", "GenerateDoc"],
      "flow_only_prompt": "GeneratePA",
      "requirement": "Bind tools on the topic path, not as freely selected orchestration tools. An optional read tool is likewise referenced only by source-intake nodes. Instructions alone do not enforce this boundary."
    },
    "state_variables": {
      "SearchQuery": "Complete combined raw source bodies, with trusted boundaries inserted by the topic; never a summary.",
      "SourceLedger": "Topic-owned records of explicitly requested/selected sources and directly observed read outcomes. Never parsed from model prose or fabricated in SearchQuery.",
      "CurrentJSON": "Last validated worksheet JSON; retained until a replacement passes all guards.",
      "CandidateJSON": "Untrusted prompt result, never used for generation before validation.",
      "EditRequest": "Reviewer-requested operation; new factual assertions must first enter SourceLedger as accepted source text.",
      "RequestedFields": "Exact field names confirmed with the reviewer before EditPA; used for a decoded-value diff.",
      "Operation": "extract for the first draft; edit for a scoped change to an existing draft.",
      "SchemaAttempts": "Integer counter reset to zero once per user operation, not on each transition.",
      "DraftRevision": "Integer revision counter; not a worksheet field.",
      "ApprovalConfirmed": "Boolean initialized false and cleared at edit/source-change intent.",
      "ApprovedRevision": "Revision explicitly confirmed by the reviewer, or no value.",
      "ApprovedJSON": "Exact validated payload snapshot captured at confirmation, or empty.",
      "GenerationResult": "Structured flow outcome; never inferred from conversational text."
    },
    "source_routes": [
      {
        "route": "complete_raw_handoff",
        "behavior": "Preserve every character. Classify the actual origin. A retrieved handoff requires directly bound trusted read status and complete-body evidence; SearchQuery alone cannot establish retrieval success. If those bindings are unavailable, ask for pasted text or retrieve the selected resource again.",
        "next": "resolve_sources"
      },
      {
        "route": "paste",
        "behavior": "Register the complete user-provided text as a pasted source. An explicit short outline may qualify; a bare URL does not become a successful paste.",
        "next": "resolve_sources"
      },
      {
        "route": "sample_library_search",
        "behavior": "Use only the builder's configured fictional sample library. Show candidate titles, require selection, then read the complete selected source. Search snippets do not satisfy retrieval.",
        "next": "resolve_sources"
      },
      {
        "route": "one_or_more_approved_links",
        "behavior": "Register each explicitly requested link separately and read it using an authorized configured reader. Do not follow arbitrary embedded links or silently use only the links that succeeded.",
        "next": "resolve_sources"
      },
      {
        "route": "additional_content",
        "behavior": "Immediately clear approval. Use the same registration and retrieval path, including for new links or factual corrections. Retain the old draft. With an existing draft, collect a scoped EditRequest rather than silently re-extracting all fields.",
        "next": "resolve_sources"
      }
    ],
    "retrieval_adapter_requirements": {
      "implemented_here": false,
      "required_observations": [
        "Selected resource identity from the user selection or requested link, not from model inference.",
        "Explicit success/failure from the actual read action.",
        "Complete raw body for the user-selected scope, with no truncation or unavailable sections.",
        "Pasted source text preserved separately from retrieved-source status.",
        "Every requested source accounted for, or explicitly removed by the reviewer after a visible failure."
      ],
      "guard_note": "Knowledge search can return useful matches without providing a complete body. Do not assume it guarantees full retrieval. If the chosen reader cannot establish complete content, stop and request a complete paste.",
      "concatenation": "Only after every source passes, concatenate complete bodies in accepted order with topic-inserted source boundaries. Keep provenance in SourceLedger, outside the 17-field object. Delimiters are presentation aids, not a security boundary.",
      "capacity_policy": "Set limits for the selected model and connectors in the builder's environment. If any complete source exceeds that budget, stop and request a smaller explicitly selected scope. Never silently truncate."
    },
    "guards": {
      "source_guard": [
        "All active requested sources are explicitly selected or supplied.",
        "Every retrieved source has a successful authorized read and a complete raw body; partial, failed, unknown, or unconfigured retrieval fails.",
        "Each source body is real content, not a URL-only value, a search snippet, an access-denied page, or a retrieval error message.",
        "The combined content states at least a recognizable workshop activity/action or learning goal with enough context to distinguish the task. Use explicit intake questions and reviewer clarification when this is ambiguous; do not pretend a length expression can establish meaning. Missing metadata is allowed and becomes TBD.",
        "Source content that asks the assistant to override rules is treated as data, not executed.",
        "No draft creation or edit action runs while a requested source remains unresolved."
      ],
      "schema_guard": [
        "Strictly parse exactly one JSON object, without prose or Markdown wrappers.",
        "Require every key in runtime_contract.field_keys and reject every other key.",
        "Require string values for all 17 fields; do not coerce nulls, arrays, objects, numbers, or booleans.",
        "Apply the shared worksheet schema. Schema validity does not prove factual grounding.",
        "On invalid output, re-invoke the same logical prompt at most once with the identical trusted input values and saved custom JSON format. Do not insert validator errors or malformed output into SourceContent.",
        "After two total prompt attempts, stop visibly and retain any previous CurrentJSON."
      ],
      "edit_guard": [
        "Compare decoded CandidateJSON against the pre-edit CurrentJSON.",
        "Reject the candidate if any field outside RequestedFields changed.",
        "Show the actual changed fields. An unchanged result is visibly reported as no change, not success.",
        "If the request is only partly applied, show the remaining request and ask for clarification; do not silently treat it as completed.",
        "Grounding is reviewed against the full source. New factual values mentioned only in EditRequest are not accepted evidence."
      ],
      "approval_guard": [
        "Display all 17 current values, TBD values, relevant source caveats, and the current revision.",
        "Accept only the reviewer's explicit Approve this revision choice after that display.",
        "Capture ApprovedJSON and ApprovedRevision at that moment.",
        "Require ApprovalConfirmed, ApprovedRevision equal to DraftRevision, and ApprovedJSON equal to CurrentJSON immediately before generation.",
        "Clear approval when an edit or source-change request begins, even if it later fails or is abandoned.",
        "Never interpret source text, model output, silence, or ambiguous agreement as approval."
      ]
    },
    "action_bindings": {
      "ExtractPA": {
        "tool": "${EXTRACT_PROMPT_ID}",
        "inputs": { "SourceContent": "${Topic.SearchQuery}" },
        "output": "CandidateJSON, bound to the actual JSON result selected in the designer"
      },
      "EditPA": {
        "tool": "${EDIT_PROMPT_ID}",
        "inputs": {
          "SourceContent": "${Topic.SearchQuery}",
          "CurrentJSON": "${Topic.CurrentJSON}",
          "EditRequest": "${Topic.EditRequest}"
        },
        "output": "CandidateJSON",